10/29/2020 16:23:02,Como aprendí a manejar las diferentes plataformas para comunicarme con los estudiantes,Experimentando un mundo nuevo,Resultados positivos,Estimular el aprendizaje y transmitir prácticas,Habilidades de vida prácticas/pensando en futura empleabilidad,Aplicar lo aprendido haciendo cosas concretas,Las restricciones de tiempo,Maestros y rectores,Ayudar a los estudiantes a alcanzar los objetivos,Socialmente/en grupo,Liderado por el maestro,Necesidades emergentes,I.E.  SALLE CAMPOAMOR,,Felicidad,Con Frecuencia,La forma cómo los estudiantes aprenden,"8, 9, 10, 11",Mujer,50 a 59,
10/29/2020 16:24:12,Sí,ESTRATEGIAS PARA TRANSMITIR Y MEJORAR APRENDIZAJES.,Resultados mixtos,Estimular el aprendizaje y transmitir prácticas,Buenas bases de comprensión para futuros aprendizajes,Experimentar y crear,Habilidades y capacitación,La IE y la Secretaría,Abrir nuevos mundos para los estudiantes,Socialmente/en grupo,Liderado por el maestro,Prácticas establecidas,I.E.  SALLE CAMPOAMOR,,Felicidad,Todo el tiempo,Innovación / creatividad,,,,Primaria
10/29/2020 16:28:58,"Realmente el trabajo con jóvenes es un reto constante por la sencilla razón de que todos los días hay que procurar innovar y centrar su atención. Es por eso que en cada clase se propone un trabajo, una lectura previa al encuentro con el fin de que lleguen con ciertos conocimientos, esto posibilita la participación, la preparación del tema, la crítica y se fomenta la argumentación. Ha dado resultados positivos en la medida que se ven en la necesidad de prepararse para la clase. Lo negativo es que no todos lo hacen, porque son siempre los mismos jóvenes interesados y responsables de su trabajo y su desarrollo cognitivo. ",#ParticipandoAndo,Resultados mixtos,Estimular el aprendizaje y transmitir prácticas,Buenas bases de comprensión para futuros aprendizajes,Experimentar y crear,Las restricciones de tiempo,Estudiantes y padres,Ayudar a los estudiantes a alcanzar los objetivos,Socialmente/en grupo,Liderado por el estudiante,Necesidades emergentes,I.E.  SALLE CAMPOAMOR,,Felicidad,Con Frecuencia,La forma cómo los estudiantes aprenden,"6, 9, 11",Mujer,40 a 49,Postgrado
10/29/2020 16:46:60,"La gamificación nos permite crear clases y dinamizar nuestra enseñanza, cuando quieras te puedo enseñar. ",#gamificación ,Resultados positivos,Estimular el aprendizaje y transmitir prácticas,Buenas bases de comprensión para futuros aprendizajes,Experimentar y crear,Las restricciones de tiempo,La IE y la Secretaría,Abrir nuevos mundos para los estudiantes,Socialmente/en grupo,Liderado por el maestro,Necesidades emergentes,I.E.  SALLE CAMPOAMOR,,Felicidad,Con Frecuencia,Innovación / creatividad,3,Mujer,50 a 59,Postgrado
10/20/2020 9:26:10,Fue una experiencia muy significativa,#educacion participación,Resultados interesantes,Estimular el aprendizaje y transmitir prácticas,Habilidades de vida prácticas/pensando en futura empleabilidad,Experimentar y crear,Habilidades y capacitación,Maestros y rectores,Ayudar a los estudiantes a alcanzar los objetivos,Socialmente/en grupo,Liderado por el maestro,Prácticas establecidas,CENTRO EDUCATIVO EL MANZANILLO,,Felicidad,,,,,,
10/20/2020 9:26:27,Le respondería que si y le contaría rápidamente en que consiste ,#selotengo,Resultados interesantes,Estimular el aprendizaje y transmitir prácticas,Habilidades de vida prácticas/pensando en futura empleabilidad,Aplicar lo aprendido haciendo cosas concretas,"Recursos educativos (ej.. tecnología, fondos, etc.)",Maestros y rectores,Ayudar a los estudiantes a alcanzar los objetivos,Socialmente/en grupo,Liderado por el maestro,Necesidades emergentes,CENTRO EDUCATIVO EL MANZANILLO,,Felicidad,,,,,,
10/20/2020 9:30:15,"Le contaría que el trabajo por colectivos pedagógicos ha facilitado las interacciones y el desarrollo de actividades al interior del Centro Educativo. Hemos tenido oportunidad de participar en  diferentes proyectos de investigación con el acueducto veredas, con los líderes de la vereda y grupo guardabosques para que los estudiantes conozcan su territorio y se apropien de él.",#hastaglos niños interactuan,Resultados positivos,Estimular el aprendizaje y transmitir prácticas,Comprensión del mundo que los rodea,Experimentar y crear,Habilidades y capacitación,Maestros y rectores,Abrir nuevos mundos para los estudiantes,Socialmente/en grupo,Liderado por el estudiante,Necesidades emergentes,CENTRO EDUCATIVO EL MANZANILLO,,Felicidad,,,,,,
10/20/2020 9:30:25,si,si,Resultados mixtos,Estimular el aprendizaje y transmitir prácticas,Buenas bases de comprensión para futuros aprendizajes,Experimentar y crear,"Recursos educativos (ej.. tecnología, fondos, etc.)",La IE y la Secretaría,Dar soporte emocional a los estudiantes,Socialmente/en grupo,Liderado por el maestro,Necesidades emergentes,CENTRO EDUCATIVO EL MANZANILLO,,Angustia/miedo,Todo el tiempo,,,,,
10/20/2020 9:32:43,dinámicas y juegos en las clases virtuales,#jugando aprendo,Resultados positivos,El desarrollo social del alumno,Habilidades de vida prácticas/pensando en futura empleabilidad,Experimentar y crear,"Recursos educativos (ej.. tecnología, fondos, etc.)",Maestros y rectores,Ayudar a los estudiantes a alcanzar los objetivos,Socialmente/en grupo,Liderado por el maestro,Necesidades emergentes,CENTRO EDUCATIVO EL MANZANILLO,,Felicidad,,,,,,
10/20/2020 9:33:23,Solicitar a mis estudiantes q compartieran mensajes de amor y amistad de manera virtual por diferentes medios y usando su creatividad.,#amigosdesdeladistancia,Resultados positivos,El desarrollo social del alumno,Habilidades de vida prácticas/pensando en futura empleabilidad,Experimentar y crear,"Recursos educativos (ej.. tecnología, fondos, etc.)",Estudiantes y padres,Dar soporte emocional a los estudiantes,Socialmente/en grupo,,Necesidades emergentes,CENTRO EDUCATIVO EL MANZANILLO,,Felicidad,Con Frecuencia,Lo que hago en mi tiempo libre,,,,
10/20/2020 9:33:45,"Si por supuesto, estoy trabajando con mis alumnos con classDojo",Motivar a mis alumnos a traves de las diferente aplicaciones que nos ofrece la tecnología,Resultados positivos,Estimular el aprendizaje y transmitir prácticas,Buenas bases de comprensión para futuros aprendizajes,Experimentar y crear,"Recursos educativos (ej.. tecnología, fondos, etc.)",Maestros y rectores,Abrir nuevos mundos para los estudiantes,Socialmente/en grupo,Liderado por el maestro,Prácticas establecidas,CENTRO EDUCATIVO EL MANZANILLO,,Felicidad,Con Frecuencia,,,,,
10/20/2020 9:38:11,Por medio de un texto denominado Meter el diablo en el infierno realicé un ejercicio de argumentación con audiencias y debates.,#Metereldiabloenelinfierno,Resultados interesantes,El desarrollo social del alumno,Comprensión del mundo que los rodea,Aplicar lo aprendido haciendo cosas concretas,"Recursos educativos (ej.. tecnología, fondos, etc.)",Estudiantes y padres,Abrir nuevos mundos para los estudiantes,Socialmente/en grupo,Liderado por el estudiante,Prácticas establecidas,CENTRO EDUCATIVO EL MANZANILLO,,Felicidad,De vez en cuando,Mi aporte a la humanidad/al mundo/a los demás,4,Mujer,30 a 39,Postgrado
10/20/2020 9:40:10,He ensayado la sala de messenger de whatsapp y son pocos los estudiantes que se conectan. Hay dificultad con la conexión a internet y poca participación de los estudiantes.,#dificilconexión,Resultados mixtos,Estimular el aprendizaje y transmitir prácticas,Buenas bases de comprensión para futuros aprendizajes,Experimentar y crear,Habilidades y capacitación,Maestros y rectores,Ayudar a los estudiantes a alcanzar los objetivos,Socialmente/en grupo,Liderado por el maestro,Necesidades emergentes,CENTRO EDUCATIVO EL MANZANILLO,,Tristeza,Con Frecuencia,Tecnología y herramientas digitales,3,Mujer,40 a 49,Postgrado
10/11/2020 13:04:00,si estoy experimentando para adquirir deferentes posibilidades,#diferentesposibilidades,Resultados interesantes,Estimular el aprendizaje y transmitir prácticas,Buenas bases de comprensión para futuros aprendizajes,Experimentar y crear,Habilidades y capacitación,Estudiantes y padres,Abrir nuevos mundos para los estudiantes,Socialmente/en grupo,Liderado por el estudiante,Necesidades emergentes,I.E. LUCRECIO JARAMILLO VELEZ,,Felicidad,Todo el tiempo,Innovación / creatividad,"9, 10, 11",Hombre,50 a 59,Postgrado
10/11/2020 13:05:00,sí,seguimiento al crecimiento de una planta,Resultados positivos,Estimular el aprendizaje y transmitir prácticas,Habilidades de vida prácticas/pensando en futura empleabilidad,Aplicar lo aprendido haciendo cosas concretas,Habilidades y capacitación,Maestros y rectores,Abrir nuevos mundos para los estudiantes,Individual/independientemente,Liderado por el estudiante,Necesidades emergentes,I.E. LUCRECIO JARAMILLO VELEZ,,Felicidad,De vez en cuando,El cuidado del medio ambiente,5,Hombre,40 a 49,Primaria
10/11/2020 13:05:00,,,Resultados interesantes,Estimular el aprendizaje y transmitir prácticas,Buenas bases de comprensión para futuros aprendizajes,Experimentar y crear,Habilidades y capacitación,Estudiantes y padres,Abrir nuevos mundos para los estudiantes,Socialmente/en grupo,Liderado por el maestro,Prácticas establecidas,I.E. LUCRECIO JARAMILLO VELEZ,,Felicidad,Con Frecuencia,Tecnología y herramientas digitales,"6, 7, 8",Mujer,50 a 59,Universitario
10/11/2020 13:05:00,"Le compartiria mis experiencia para retroalimentar no solo a mi colega, si no tambien poder contar con él en otras situaciones",#ayudacolaborativa,Resultados positivos,Estimular el aprendizaje y transmitir prácticas,Buenas bases de comprensión para futuros aprendizajes,Experimentar y crear,"Recursos educativos (ej.. tecnología, fondos, etc.)",La IE y la Secretaría,Ayudar a los estudiantes a alcanzar los objetivos,Socialmente/en grupo,Liderado por el maestro,Necesidades emergentes,I.E. LUCRECIO JARAMILLO VELEZ,,Felicidad,De vez en cuando,El trabajo en equipo,"8, 9, 10, 11",Mujer,40 a 49,Postgrado
10/11/2020 13:06:00,Obligarlos a que tengan la cámara encendida todo el tiempo durante los encuentros virtuales,#necesitoverte,Resultados mixtos,Estimular el aprendizaje y transmitir prácticas,Buenas bases de comprensión para futuros aprendizajes,Reflexionar y comprender,"Recursos educativos (ej.. tecnología, fondos, etc.)",Estudiantes y padres,Ayudar a los estudiantes a alcanzar los objetivos,,Liderado por el maestro,Prácticas establecidas,I.E. LUCRECIO JARAMILLO VELEZ,,no estoy seguro,Con Frecuencia,La forma cómo los estudiantes aprenden,"10, 11",Mujer,50 a 59,Postgrado
10/11/2020 13:06:00,padlet,#padlet de ideas,Resultados positivos,Estimular el aprendizaje y transmitir prácticas,Habilidades de vida prácticas/pensando en futura empleabilidad,Experimentar y crear,"Recursos educativos (ej.. tecnología, fondos, etc.)",Maestros y rectores,Abrir nuevos mundos para los estudiantes,Socialmente/en grupo,Liderado por el maestro,Prácticas establecidas,I.E. LUCRECIO JARAMILLO VELEZ,,Felicidad,Con Frecuencia,La forma cómo los estudiantes aprenden,"7, 8",Mujer,40 a 49,Postgrado
10/11/2020 13:07:00,Le contaría sobre experiencias laboratorio Vivo.,"Laboratorio Vivo, una experiencia significativa.",Resultados positivos,El desarrollo social del alumno,Habilidades de vida prácticas/pensando en futura empleabilidad,Reflexionar y comprender,Habilidades y capacitación,Maestros y rectores,Ayudar a los estudiantes a alcanzar los objetivos,Socialmente/en grupo,Liderado por el estudiante,Necesidades emergentes,I.E. LUCRECIO JARAMILLO VELEZ,,Felicidad,Con Frecuencia,El trabajo en equipo,"10, 11",Mujer,50 a 59,Postgrado
10/11/2020 13:07:00,"La conferencia me regaló ideas maravillosas, aunque no estoy de acuerdo con algunos de los puntos tratados. De todas maneras, se ilustró de forma muy práctica cómo diversificar con los estudiantes el aprendizaje de la gramática inglesa para que se les facilite el manejo de las reglas gramaticales del inglés y puedan verlas de forma mucho más simple y cercana. Se explican y aplican a través de diferentes recursos y permiten que en las dos horas de clase de la semana se logre avanzar significativamente. Finalmente, se logra comprender que la gramática se hace mucho más práctica y lógica a través de la práctica, en la conversación en el aula y la experiencia lingüística.",Inglés a tu alcance,Resultados mixtos,Estimular el aprendizaje y transmitir prácticas,Buenas bases de comprensión para futuros aprendizajes,Aplicar lo aprendido haciendo cosas concretas,Las restricciones de tiempo,La IE y la Secretaría,Ayudar a los estudiantes a alcanzar los objetivos,Socialmente/en grupo,Liderado por el maestro,Prácticas establecidas,I.E. LUCRECIO JARAMILLO VELEZ,,Felicidad,Con Frecuencia,La forma cómo los estudiantes aprenden,"6, 7, 8",Mujer,40 a 49,Postgrado
10/11/2020 13:07:00,"la practica pedagógica es un ensayo, error cada todo el tiempo. Por eso disfruto la enseñanza.",se aprende con los chicos todo el tiempo,Resultados interesantes,Estimular el aprendizaje y transmitir prácticas,Habilidades de vida prácticas/pensando en futura empleabilidad,Experimentar y crear,"Recursos educativos (ej.. tecnología, fondos, etc.)",Estudiantes y padres,Abrir nuevos mundos para los estudiantes,Socialmente/en grupo,Liderado por el maestro,Necesidades emergentes,I.E. LUCRECIO JARAMILLO VELEZ,,Felicidad,Todo el tiempo,El trabajo en equipo,"3, 4",Mujer,40 a 49,Postgrado
10/11/2020 13:08:00,Cambio de plataforma para comunicarnos,Herramientas comunicativas,Resultados interesantes,Estimular el aprendizaje y transmitir prácticas,Comprensión del mundo que los rodea,Experimentar y crear,Habilidades y capacitación,La IE y la Secretaría,Abrir nuevos mundos para los estudiantes,Socialmente/en grupo,Liderado por el maestro,Necesidades emergentes,I.E. LUCRECIO JARAMILLO VELEZ,,Felicidad,Con Frecuencia,Tecnología y herramientas digitales,"3, 4, 5",Mujer,50 a 59,Postgrado
10/11/2020 13:08:00,CONVERSATORIO Que pasari si......,HACIA LA QUINTA REVOLUCION INDUSTRIAL,Resultados mixtos,El desarrollo social del alumno,Comprensión del mundo que los rodea,Experimentar y crear,"Recursos educativos (ej.. tecnología, fondos, etc.)",Estudiantes y padres,Abrir nuevos mundos para los estudiantes,Socialmente/en grupo,Liderado por el maestro,Prácticas establecidas,I.E. LUCRECIO JARAMILLO VELEZ,,Felicidad,Todo el tiempo,Mi aporte a la humanidad/al mundo/a los demás,11,Mujer,60 a 69,Postgrado
10/11/2020 13:08:00,Si encuentros sincrónicos por zoom con niños de preescolar,#zoomniñospreescolar,Resultados mixtos,Estimular el aprendizaje y transmitir prácticas,Buenas bases de comprensión para futuros aprendizajes,Experimentar y crear,,La IE y la Secretaría,Dar soporte emocional a los estudiantes,Socialmente/en grupo,Liderado por el maestro,Necesidades emergentes,I.E. LUCRECIO JARAMILLO VELEZ,,Felicidad,Con Frecuencia,Lo que hago en las horas de clase,,Mujer,50 a 59,Postgrado
10/11/2020 13:08:00,"Trate de ser más dinámico, más recursivo, con videos cortos, historias recientes, trayendo la antigüedad a la actualidad",Historia corta,Resultados positivos,El desarrollo social del alumno,Habilidades de vida prácticas/pensando en futura empleabilidad,Aplicar lo aprendido haciendo cosas concretas,Habilidades y capacitación,Maestros y rectores,Dar soporte emocional a los estudiantes,Socialmente/en grupo,Liderado por el maestro,Necesidades emergentes,I.E. LUCRECIO JARAMILLO VELEZ,,Felicidad,Con Frecuencia,El trabajo en equipo,"6, 7",Hombre,60 a 69,Universitario
10/11/2020 13:08:00,"INVESTIGACIÓN DE CAMPO: Consistió en que los estudiantes en sus sitios donde pasan el día construyeron encuesta, aplicaron encuesta, hicieron desde su perspectiva análisis de resultados y por último entregaron una propuesta de intervención según lo que encontraron.",#investigación,Resultados positivos,Estimular el aprendizaje y transmitir prácticas,Habilidades de vida prácticas/pensando en futura empleabilidad,Aplicar lo aprendido haciendo cosas concretas,Las restricciones de tiempo,Maestros y rectores,Abrir nuevos mundos para los estudiantes,Socialmente/en grupo,Liderado por el estudiante,Prácticas establecidas,I.E. LUCRECIO JARAMILLO VELEZ,,Felicidad,Con Frecuencia,La forma cómo los estudiantes aprenden,,Hombre,50 a 59,Postgrado
10/11/2020 13:09:00,"En un momento por el tema de la virtualidad, con los estudiantes del grado 11, para una clase preparamos cada uno un personaje, nos vestimos como él o ella y, contamos toda la historia del personaje que cada uno preparó y participamos de la clase como su fuésemos otros personajes, y todo estuvo acorde con la temática de la clase de filosofía.",#soydiferente,Resultados positivos,El desarrollo social del alumno,Comprensión del mundo que los rodea,Aplicar lo aprendido haciendo cosas concretas,Habilidades y capacitación,Maestros y rectores,Abrir nuevos mundos para los estudiantes,Socialmente/en grupo,Liderado por el estudiante,Necesidades emergentes,I.E. LUCRECIO JARAMILLO VELEZ,,Felicidad,De vez en cuando,Mi aporte a la humanidad/al mundo/a los demás,"8, 10, 11",Hombre,20 a 29,Universitario
10/11/2020 13:09:00,Descripción del proceso que se está realizando y los resultados que se han obtenido.,#asiLoHagoYo,Resultados mixtos,Estimular el aprendizaje y transmitir prácticas,Habilidades de vida prácticas/pensando en futura empleabilidad,Experimentar y crear,"Recursos educativos (ej.. tecnología, fondos, etc.)",Maestros y rectores,Abrir nuevos mundos para los estudiantes,Socialmente/en grupo,Liderado por el maestro,Prácticas establecidas,I.E. LUCRECIO JARAMILLO VELEZ,,Felicidad,De vez en cuando,La forma cómo los estudiantes aprenden,"10, 11",Hombre,50 a 59,Postgrado
10/11/2020 13:09:00,"PREPARA SABER, DESARROLLAR CON LOS ESTUDIANTES ESTAS PREGUNTAS DENTRO DEL AULA DE CLASE, QUE LLEVEN A LA INDAGACIÓN, EL DEBATE Y OBTENER LA RESPUESTA CORRECTA.",APRENDIENDO TODOS,Resultados positivos,Estimular el aprendizaje y transmitir prácticas,Habilidades de vida prácticas/pensando en futura empleabilidad,Aplicar lo aprendido haciendo cosas concretas,Habilidades y capacitación,Maestros y rectores,Abrir nuevos mundos para los estudiantes,Socialmente/en grupo,Liderado por el maestro,Prácticas establecidas,I.E. LUCRECIO JARAMILLO VELEZ,,Felicidad,Todo el tiempo,El trabajo en equipo,"3, 4, 5",Mujer,30 a 39,Postgrado
10/11/2020 13:12:00,"Si, estuvimos realizando en un período iniciación a la fotografía, e hicimos un trabajo de síntesis del conocimiento de los oficios practicando los diferentes planos y ángulos fotográficos, todo esto realmente por aprovechar la cotidianidad y la situación temporal que estamos viviendo.","Los oficios en cuarentena , RIS Empatía",Resultados interesantes,Estimular el aprendizaje y transmitir prácticas,Habilidades de vida prácticas/pensando en futura empleabilidad,Experimentar y crear,Las restricciones de tiempo,Maestros y rectores,Abrir nuevos mundos para los estudiantes,Individual/independientemente,Liderado por el maestro,Prácticas establecidas,I.E. LUCRECIO JARAMILLO VELEZ,,Felicidad,Con Frecuencia,Innovación / creatividad,"6, 7, 8",Mujer,40 a 49,Bachiller
10/11/2020 13:13:00,"Estrategias de conexión con los estudiantes, partiendo de diálogos y generando empatía.",Acercamiento al estudiante y estimulación del aprendizaje.,Resultados positivos,Estimular el aprendizaje y transmitir prácticas,Habilidades de vida prácticas/pensando en futura empleabilidad,Reflexionar y comprender,Habilidades y capacitación,Estudiantes y padres,Dar soporte emocional a los estudiantes,Individual/independientemente,Liderado por el maestro,Necesidades emergentes,I.E. LUCRECIO JARAMILLO VELEZ,,Felicidad,Con Frecuencia,Relación con los estudiantes,6,Mujer,50 a 59,Postgrado
10/11/2020 13:13:00,"Exploro nuevas plataformas digitales que ayudan mucho al encuentro con alumnos a través de la internet. Wordwall, Genially, Padle entre otras.",#tecompartoalgonuevo,Resultados positivos,Estimular el aprendizaje y transmitir prácticas,Comprensión del mundo que los rodea,Experimentar y crear,Habilidades y capacitación,La IE y la Secretaría,Abrir nuevos mundos para los estudiantes,Socialmente/en grupo,Liderado por el estudiante,Prácticas establecidas,I.E. LUCRECIO JARAMILLO VELEZ,,Felicidad,Con Frecuencia,El trabajo en equipo,"8, 9, 10, 11",Hombre,50 a 59,Postgrado
10/11/2020 13:13:00,Escucha y análisis de videos,#mividaenvideo,Resultados positivos,El desarrollo social del alumno,Comprensión del mundo que los rodea,Aplicar lo aprendido haciendo cosas concretas,Las restricciones de tiempo,Maestros y rectores,Abrir nuevos mundos para los estudiantes,Individual/independientemente,Liderado por el maestro,Necesidades emergentes,I.E. LUCRECIO JARAMILLO VELEZ,,Felicidad,Con Frecuencia,Mi aporte a la humanidad/al mundo/a los demás,"8, 9, 10, 11",Hombre,40 a 49,Postgrado
10/11/2020 13:13:00,Lo nuevo seria clases obligadas por zoom,xx,Resultados mixtos,Cumplir con el currículo,Comprensión del mundo que los rodea,Experimentar y crear,Habilidades y capacitación,La IE y la Secretaría,Ayudar a los estudiantes a alcanzar los objetivos,Individual/independientemente,Liderado por el maestro,Prácticas establecidas,I.E. LUCRECIO JARAMILLO VELEZ,,no estoy seguro,Casi nunca,Tecnología y herramientas digitales,,Mujer,60 a 69,Postgrado
10/11/2020 13:14:00,Fueron múltiples experiencias,Sorprendidos,Resultados interesantes,Estimular el aprendizaje y transmitir prácticas,Comprensión del mundo que los rodea,Reflexionar y comprender,Habilidades y capacitación,La IE y la Secretaría,Ayudar a los estudiantes a alcanzar los objetivos,Socialmente/en grupo,Liderado por el maestro,Prácticas establecidas,I.E. LUCRECIO JARAMILLO VELEZ,,Felicidad,De vez en cuando,Tecnología y herramientas digitales,"6, 7, 8",Mujer,50 a 59,Universitario
10/11/2020 13:18:00,Le comentaría que he trabajado practicas de laboratorio virtuales y simulaciones l,#laboratorios virtuales,Resultados positivos,Estimular el aprendizaje y transmitir prácticas,Comprensión del mundo que los rodea,Experimentar y crear,"Recursos educativos (ej.. tecnología, fondos, etc.)",Estudiantes y padres,Ayudar a los estudiantes a alcanzar los objetivos,Individual/independientemente,Liderado por el estudiante,Necesidades emergentes,I.E. LUCRECIO JARAMILLO VELEZ,,Felicidad,De vez en cuando,Lo que hago en las horas de clase,"9, 10, 11",Mujer,40 a 49,Postgrado
10/11/2020 13:19:00,Si. Se le ha estado pidiendo a los estudiantes que elaboren videos cortos y compartan sobre lo aprendido de determinados temas y se han visto resultados muy buenos. Se tiene la posibilidad de escuchar a aquellos compañeros que muy pocos hablan o participan en la clase.,10vid,Resultados positivos,Estimular el aprendizaje y transmitir prácticas,Habilidades de vida prácticas/pensando en futura empleabilidad,Experimentar y crear,Las restricciones de tiempo,Estudiantes y padres,Ayudar a los estudiantes a alcanzar los objetivos,Socialmente/en grupo,Liderado por el estudiante,Prácticas establecidas,I.E. LUCRECIO JARAMILLO VELEZ,,Felicidad,Con Frecuencia,La forma cómo los estudiantes aprenden,"6, 8",Hombre,50 a 59,Postgrado
10/11/2020 13:20:00,"EL DÍA DE LOS DISFRACES ME APARECIÓ UN GRUPO ,TODOS VESTIDOS DE CALAVERAS. INMEDIATAMENTE YO TAMBIÉN ME DISFRACÉ E HICIMOS UN ANALISIS SUPER CHEVERE Y A LA LUZ DE ELLO NOS LEÍMOS EL CUENTO ""EL DISFRAZ"" DE EMILIA PARDO BAZÁN. FUE MUY BONITO EL TRABAJO.","NUMERAL: DISFRUTE CON SUS ESTUDIANTES, APRENDIENDO SIEMPRE.",Resultados positivos,Estimular el aprendizaje y transmitir prácticas,Comprensión del mundo que los rodea,Experimentar y crear,Las restricciones de tiempo,Estudiantes y padres,Abrir nuevos mundos para los estudiantes,Socialmente/en grupo,Liderado por el maestro,Prácticas establecidas,I.E. LUCRECIO JARAMILLO VELEZ,,Felicidad,Con Frecuencia,Relación con los estudiantes,8,Mujer,50 a 59,Postgrado
10/11/2020 13:22:00,"Presentación de contenidos integrados, se vincula la parte de el ejercicio fisico, yoga, y trabajo manual desde el uso del blog",Trabajo en casa aprendo y me divierto,Resultados mixtos,Estimular el aprendizaje y transmitir prácticas,Habilidades de vida prácticas/pensando en futura empleabilidad,Aplicar lo aprendido haciendo cosas concretas,"Recursos educativos (ej.. tecnología, fondos, etc.)",Estudiantes y padres,Abrir nuevos mundos para los estudiantes,Individual/independientemente,Liderado por el maestro,Prácticas establecidas,I.E. LUCRECIO JARAMILLO VELEZ,,Angustia/miedo,De vez en cuando,Tecnología y herramientas digitales,,Mujer,50 a 59,Universitario
10/11/2020 13:22:00,Planeación y diseño de una WebQuest,#WebQuest divertido aprendizaje,Resultados interesantes,Estimular el aprendizaje y transmitir prácticas,Habilidades de vida prácticas/pensando en futura empleabilidad,Aplicar lo aprendido haciendo cosas concretas,"Recursos educativos (ej.. tecnología, fondos, etc.)",La IE y la Secretaría,Abrir nuevos mundos para los estudiantes,Socialmente/en grupo,Liderado por el estudiante,Prácticas establecidas,I.E. LUCRECIO JARAMILLO VELEZ,,Felicidad,Con Frecuencia,El trabajo en equipo,4,Mujer,30 a 39,Postgrado
10/11/2020 13:23:00,"Implemente vídeos , imágenes y juegos con los estudiantes",Divertiaprendizaje,Resultados positivos,Estimular el aprendizaje y transmitir prácticas,Buenas bases de comprensión para futuros aprendizajes,Experimentar y crear,"Recursos educativos (ej.. tecnología, fondos, etc.)",Estudiantes y padres,Ayudar a los estudiantes a alcanzar los objetivos,Socialmente/en grupo,Liderado por el estudiante,Prácticas establecidas,I.E. LUCRECIO JARAMILLO VELEZ,,Felicidad,Muy rara vez,El trabajo en equipo,8,Mujer,50 a 59,Universitario
