10/27/2020 9:27:04,Con los estudiantes se está abordando una estrategia que permitirá mejorar el sentido de pertenencia hacia los recursos físicos de la institución por parte de los estudiantes.,#yocuidomicolegio,Resultados mixtos,El desarrollo social del alumno,Comprensión del mundo que los rodea,Reflexionar y comprender,Habilidades y capacitación,Maestros y rectores,Ayudar a los estudiantes a alcanzar los objetivos,Socialmente/en grupo,Liderado por el maestro,Necesidades emergentes,I.E CARACAS,,Felicidad,Con Frecuencia,El cuidado del medio ambiente,,Mujer,40 a 49,Postgrado
10/27/2020 9:27:24,Reciclaje de basuras,Reciclaje,Resultados interesantes,Estimular el aprendizaje y transmitir prácticas,Comprensión del mundo que los rodea,Experimentar y crear,Habilidades y capacitación,Maestros y rectores,Ayudar a los estudiantes a alcanzar los objetivos,Socialmente/en grupo,Liderado por el maestro,Necesidades emergentes,I.E CARACAS,,Felicidad,Con Frecuencia,El trabajo en equipo,,Mujer,50 a 59,Postgrado
10/27/2020 9:31:26,"Imaginate que un niño, se esta inventando que le estan haciendo bulying sus compañeros,segun él,le quitan la lonchera en el descanso lo amenazan y le pegan en el salón,cosa que no sucede,esto me tiene muy preocupada.El niño llego asta el punto de tener crisis de nervios,no querer ir a estudiar y tenerlo que llevar al medico, se le inicia tratamiento sicilogico para ayudar al estudiante,su familia tambien esta bastante preocupada por los comportamientos que a presentado el niño últimamente,contando una serie de acontesimientos que no son acordes a la actitud de l niño en la escuela.",   # bullying en la escuela.,Resultados positivos,El desarrollo social del alumno,Habilidades de vida prácticas/pensando en futura empleabilidad,Reflexionar y comprender,Habilidades y capacitación,Estudiantes y padres,Dar soporte emocional a los estudiantes,Socialmente/en grupo,Liderado por el maestro,Necesidades emergentes,I.E CARACAS,,no estoy seguro,De vez en cuando,El trabajo en equipo,,Mujer,40 a 49,Primaria
10/27/2020 9:31:36,"Le dirá que sí, que en una experiencia nueva, que estoy buscando nuevas didácticas  para la enseñanza del idioma inglés. ","#""PLAYING I LEARN""",Resultados positivos,Estimular el aprendizaje y transmitir prácticas,Buenas bases de comprensión para futuros aprendizajes,Experimentar y crear,Las restricciones de tiempo,Maestros y rectores,Abrir nuevos mundos para los estudiantes,Socialmente/en grupo,Liderado por el maestro,Prácticas establecidas,I.E CARACAS,,Felicidad,Con Frecuencia,Mi aporte a la humanidad/al mundo/a los demás,,Mujer,50 a 59,Postgrado
10/27/2020 9:32:29,"Le comentaría que estoy muy contenta con las CDA,  Las Comunidades de Aprendizaje, que estamos logrando un trabajo colaborativo entre los maestros de Grado, cuando se reúnen, comparten experiencias, innovaciones y planean teniendo en cuenta las características de los estudiantes.","#  ""Trabajo Colaborativo, un logro Institucional""",Resultados mixtos,Estimular el aprendizaje y transmitir prácticas,Buenas bases de comprensión para futuros aprendizajes,Reflexionar y comprender,Habilidades y capacitación,La IE y la Secretaría,Abrir nuevos mundos para los estudiantes,Socialmente/en grupo,Liderado por el maestro,Necesidades emergentes,I.E CARACAS,,Felicidad,Con Frecuencia,El trabajo en equipo,,Mujer,60 a 69,Postgrado
10/27/2020 9:37:57,"Un niño de transición fue a comprar a la tienda escolar con un billete de $ 50.000. la señora de la tienda me llamo para informarme acerca de la situación. Dialogue con el niño y me dijo que su abuelita le había regalado el dinero para comprar. le explique que era mucho dinero y que debía hablar con su abuela para saber la verdad. El niño no reconoció que estaba mintiendo. llame a su abuela y ella me explicó que ese dinero lo ahorraba para pagar los servicios públicos. Lo más importante fue que logramos dialogar con el niño  la abuela y yo. Aborde la situación con el cuento ""Ramon Recuerda"". fue una experiencia donde la abuela quedo muy agradecida y el niño tuvo una oportunidad de aprender valores para la vida.",#laverdadesmejor.,Resultados positivos,El desarrollo social del alumno,Comprensión del mundo que los rodea,Reflexionar y comprender,Las restricciones de tiempo,Estudiantes y padres,Dar soporte emocional a los estudiantes,Individual/independientemente,Liderado por el estudiante,Necesidades emergentes,I.E CARACAS,,Felicidad,Casi nunca,Relación con los padres de familia,,Mujer,50 a 59,Universitario
10/27/2020 9:59:34,"En mi grupo los niños no se escuchan, hablan al mismo tiempo y hacen mucho ruido, situación que no favorece el proceso de enseñanza-aprendizaje en el aula.  Para mejorar esta situación yo he llevado al aula una campana y he explicado al grupo que cuando la suene todos vamos a hacer silencio y respirar unos segundos.  Luego continuamos con nuestro trabajo, de esa forma nos vamos a escuchar más fácilmente.  También propuse que cuando un niño o niña sintiera que era necesario tocar la campana, podía venir al frente y sonarla, eso sí, una sola vez y sin gritar ni llamar la atención, luego vuelve a su puesto.  Al principio, todos quería hacer sonar la campana, pero con el paso del tiempo, sólo la hacían sonar si veían que era necesario.  Finalmente, la campana está ahí presente pero su uso ya no es tan frecuente.  Aunque la campana no se usa tanto, por las nuevas condiciones del grupo, los niños antes de iniciar la jornada van y la buscan y la ponen al frente, sobre el escritorio de su docente.",Campana de autocontrol,Resultados positivos,El desarrollo social del alumno,Habilidades de vida prácticas/pensando en futura empleabilidad,,"Recursos educativos (ej.. tecnología, fondos, etc.)",Estudiantes y padres,Dar soporte emocional a los estudiantes,Socialmente/en grupo,Liderado por el maestro,Necesidades emergentes,I.E CARACAS,,Felicidad,Con Frecuencia,El trabajo en equipo,,Mujer,50 a 59,Universitario
10/27/2020 12:52:26,Les propuse a mis estudiantes desarrollar un juego de programación en una plataforma y se animaron a trabajarlo,Desarrollando pensamiento computacional,Resultados mixtos,Estimular el aprendizaje y transmitir prácticas,Habilidades de vida prácticas/pensando en futura empleabilidad,Experimentar y crear,"Recursos educativos (ej.. tecnología, fondos, etc.)",Estudiantes y padres,Abrir nuevos mundos para los estudiantes,Socialmente/en grupo,Liderado por el estudiante,Necesidades emergentes,I.E CARACAS,,Felicidad,Con Frecuencia,Tecnología y herramientas digitales,,Mujer,40 a 49,Postgrado
10/17/2020 9:34:04,"Le diría que si, que tengo experiencias virtuales interactivas que motivan a mis estudiantes.",#Aprende haciendo,Resultados positivos,Estimular el aprendizaje y transmitir prácticas,Buenas bases de comprensión para futuros aprendizajes,Experimentar y crear,"Recursos educativos (ej.. tecnología, fondos, etc.)",Estudiantes y padres,Ayudar a los estudiantes a alcanzar los objetivos,Socialmente/en grupo,Liderado por el maestro,Necesidades emergentes,I. E. PROGRESAR,,,,,,,,
10/19/2020 9:07:17,Le contaría la experiencia vívida después de aplicar mi trabajo de campo propuesto en mi proyecto de grado de la maestría. ,#aprendiendodelasfracciones,Resultados positivos,Estimular el aprendizaje y transmitir prácticas,Buenas bases de comprensión para futuros aprendizajes,Aplicar lo aprendido haciendo cosas concretas,"Recursos educativos (ej.. tecnología, fondos, etc.)",Maestros y rectores,Ayudar a los estudiantes a alcanzar los objetivos,Socialmente/en grupo,Liderado por el maestro,Prácticas establecidas,I. E. PROGRESAR,,,,,,,,
10/19/2020 9:07:32,Trabajo de la ONU con grado 11,#IEPMUN,Resultados positivos,Estimular el aprendizaje y transmitir prácticas,Comprensión del mundo que los rodea,Reflexionar y comprender,"Recursos educativos (ej.. tecnología, fondos, etc.)",Maestros y rectores,Ayudar a los estudiantes a alcanzar los objetivos,Socialmente/en grupo,Liderado por el estudiante,Prácticas establecidas,I. E. PROGRESAR,,,,,,,,
10/19/2020 9:08:03,Le diría que sí. ,#aprendertambienes,Resultados positivos,El desarrollo social del alumno,Comprensión del mundo que los rodea,Experimentar y crear,"Recursos educativos (ej.. tecnología, fondos, etc.)",La IE y la Secretaría,Abrir nuevos mundos para los estudiantes,Socialmente/en grupo,Liderado por el estudiante,Prácticas establecidas,I. E. PROGRESAR,,,,,,,,
10/19/2020 9:08:10,"Se llevó a cabo una intervención en la cual se hicieron parejas de trabajo en las cuales un estudiante avanzado en matemáticas apadrinaba a otro que tenía dificultades.
La intención era que se diera aprendizaje colaborativo. ",#DeaDosesMejor,Resultados positivos,Estimular el aprendizaje y transmitir prácticas,Buenas bases de comprensión para futuros aprendizajes,Reflexionar y comprender,Las restricciones de tiempo,Estudiantes y padres,Ayudar a los estudiantes a alcanzar los objetivos,Socialmente/en grupo,Liderado por el estudiante,Necesidades emergentes,I. E. PROGRESAR,,,,,,,,
10/19/2020 9:08:45,Mi experiencia nueva con mis estudiantes fue una aplicación en inglés que se llama AUTODRAW,LET´S DRAW,Resultados positivos,Estimular el aprendizaje y transmitir prácticas,Buenas bases de comprensión para futuros aprendizajes,Experimentar y crear,Habilidades y capacitación,Maestros y rectores,Abrir nuevos mundos para los estudiantes,Socialmente/en grupo,Liderado por el maestro,Necesidades emergentes,I. E. PROGRESAR,,,,,,,,
10/19/2020 9:08:56,"promoviendo la participación activa de los estudiantes en la parte oral en la asignatura de inglés en los grados 6s, 7s y 8-1.",#speakingresults,Resultados positivos,Estimular el aprendizaje y transmitir prácticas,Habilidades de vida prácticas/pensando en futura empleabilidad,Reflexionar y comprender,"Recursos educativos (ej.. tecnología, fondos, etc.)",Estudiantes y padres,Ayudar a los estudiantes a alcanzar los objetivos,Socialmente/en grupo,Liderado por el maestro,Necesidades emergentes,I. E. PROGRESAR,,,,,,,,
10/19/2020 9:09:10,"Si... Es trabajar desde la convivencia, el respeto por el otro y equidad de género ","HEY!!!!!.. YO TE RESPETO Y TÚ ME RESPETAS, ESTAMOS ",Resultados positivos,El desarrollo social del alumno,Comprensión del mundo que los rodea,Reflexionar y comprender,Habilidades y capacitación,Estudiantes y padres,Abrir nuevos mundos para los estudiantes,Socialmente/en grupo,Liderado por el maestro,Prácticas establecidas,I. E. PROGRESAR,,,,,,,,
10/19/2020 9:10:07,Dictar clase de manera virtual de matemáticas a niños de primer grado.,La clase virtual y sus resultados.,Resultados mixtos,Estimular el aprendizaje y transmitir prácticas,Comprensión del mundo que los rodea,Aplicar lo aprendido haciendo cosas concretas,"Recursos educativos (ej.. tecnología, fondos, etc.)",Estudiantes y padres,Ayudar a los estudiantes a alcanzar los objetivos,Individual/independientemente,Liderado por el maestro,Necesidades emergentes,I. E. PROGRESAR,,,,,,,,
10/19/2020 9:10:45,"Fue muy divertido, los estudiantes estuvieron muy participativos y hacían aportes muy curiosos y divertidos",nos divertimos aprendiendo,Resultados positivos,El desarrollo social del alumno,Comprensión del mundo que los rodea,Experimentar y crear,Las restricciones de tiempo,Estudiantes y padres,Abrir nuevos mundos para los estudiantes,Socialmente/en grupo,Liderado por el maestro,Prácticas establecidas,I. E. PROGRESAR,,,,,,,,
10/19/2020 9:11:03,Diseñar y resolver pasatiempos matemáticos para aplicar conceptos trabajados.,#Pastmate.,Resultados mixtos,Estimular el aprendizaje y transmitir prácticas,Buenas bases de comprensión para futuros aprendizajes,Experimentar y crear,"Recursos educativos (ej.. tecnología, fondos, etc.)",Maestros y rectores,Ayudar a los estudiantes a alcanzar los objetivos,Socialmente/en grupo,Liderado por el maestro,Prácticas establecidas,I. E. PROGRESAR,,,,,,,,
10/19/2020 9:11:58,"Bien, cierto día me encontraba en un encuentro sincrónico con un grado 4 y teníamos como propósito acompañar las actividades de una de las guía que tenía como tema la descripción. Días antes habíamos tenido un encuentro con el programa PTA donde una historia o cuento que ellos emplearon para motivarlos su encuentro llamado :""zoom "" y pensé  que a pesar de que mi guía tiene varios componentes o momentos, quería incorporar esta estrategia de motivación a mi propio encuentro. Fue sencillamente maravilloso porque a partir de este espacio la guía tomó una dirección más dinámica a la hora de desarrollar las actividades, además porque los estudiantes me pidieron enlaces del cuento y evaluación dicho encuentro como chévere, motivador y dinámico.",#Resignificacion de saberes,Resultados interesantes,Estimular el aprendizaje y transmitir prácticas,Buenas bases de comprensión para futuros aprendizajes,Experimentar y crear,Habilidades y capacitación,La IE y la Secretaría,Abrir nuevos mundos para los estudiantes,Socialmente/en grupo,Liderado por el maestro,Necesidades emergentes,I. E. PROGRESAR,,,,,,,,
10/19/2020 9:12:58,Uso de mascotas para crear un ambiente ameno y de motivación por parte de los estudiantes al momento de una asesoria virtual,Impacto de las mascotas en el aprendizaje de la biologia,Resultados interesantes,Estimular el aprendizaje y transmitir prácticas,Comprensión del mundo que los rodea,Reflexionar y comprender,"Recursos educativos (ej.. tecnología, fondos, etc.)",Maestros y rectores,Abrir nuevos mundos para los estudiantes,Socialmente/en grupo,Liderado por el estudiante,Prácticas establecidas,I. E. PROGRESAR,,,,,,,,
10/19/2020 9:13:16,"si me encanta probar nuevas estrategias, aprender de lo nuevo que me puedan brindar los estudiantes, de los resultados positivos y experiencias que se puedan dar.",nuevas experiencias,Resultados positivos,El desarrollo social del alumno,Buenas bases de comprensión para futuros aprendizajes,Reflexionar y comprender,Las restricciones de tiempo,Maestros y rectores,Ayudar a los estudiantes a alcanzar los objetivos,Socialmente/en grupo,Liderado por el estudiante,Prácticas establecidas,I. E. PROGRESAR,,,,,,,,
10/19/2020 9:14:23,"Durante esta época de cuarentena el trabajo virtual nos obligó a usar diferentes estrategias, entre ellas el uso de los vídeos donde los estudiantes debían entregar las evidencias de lo aprendido, generalmente se permite que el niño escoja cómo contar lo aprendido, en exposición, cuento, drama, dibujo, cartelera entre otros, esta dinámica permite que los estudiantes fortalezcan su parte de expresión corporal y oral, para unos ha sido mucho mas fácil que para otros, pero todos al igual que sus familias se esfuerzan por elaborarlo de la mejor manera.",expresa tu aprendizaje,Resultados positivos,Estimular el aprendizaje y transmitir prácticas,Habilidades de vida prácticas/pensando en futura empleabilidad,Experimentar y crear,"Recursos educativos (ej.. tecnología, fondos, etc.)",Maestros y rectores,Ayudar a los estudiantes a alcanzar los objetivos,Socialmente/en grupo,Liderado por el maestro,Necesidades emergentes,I. E. PROGRESAR,,,,,,,,
10/19/2020 9:14:30,"si claro compañero, todo inició cuando el número de embarazos adolescentes y padre solterísimo aumentaron dramáticamente en los estudiantes de la institución, así que desde el área de ciencias se programó un taller de métodos de anticoncepción, pero no el mismo taller de siempre, se les propuso a los estudiantes trabajar en grupos bajo tres miradas diferentes, la primera asumiendo el rol de padres, madres e hijos frente a una dificultad como el embarazo adolescente, un segundo caso es que crearan una empresa de promoción y divulgación de los derechos sexuales y reproductivos de los jóvenes y adolescentes y un tercer caso es crear una situación donde hable con su pareja como jóvenes y adolescentes sobre la planificación en su relación.",#loquesehablaconropita,Resultados interesantes,El desarrollo social del alumno,Comprensión del mundo que los rodea,Experimentar y crear,"Recursos educativos (ej.. tecnología, fondos, etc.)",Estudiantes y padres,Abrir nuevos mundos para los estudiantes,Socialmente/en grupo,Liderado por el estudiante,Necesidades emergentes,I. E. PROGRESAR,,,,,,,,
10/19/2020 9:14:38,"Una actividad que les gusto a los estudiantes fue la titiriferia donde cada grupo compartió una obra de teatro con diferentes temas. a mi grupo le toco sobre el cuidado de los abuelos con la pandemia. los estudiantes debían crear sus personajes y un guion con la ayuda de la docente. toda esta actividad se realizo por medio virtual (plataforma Meet) la participación de toda la institución fue increíble, los estudiantes realizaron trabajos muy interesantes. ",cuidemos a nuestros abuelos,Resultados positivos,El desarrollo social del alumno,Comprensión del mundo que los rodea,Experimentar y crear,"Recursos educativos (ej.. tecnología, fondos, etc.)",Maestros y rectores,Abrir nuevos mundos para los estudiantes,Socialmente/en grupo,Liderado por el maestro,Prácticas establecidas,I. E. PROGRESAR,,,,,,,,
10/19/2020 9:14:41,"Colega te cuento mi experiencia significativa con mis estudiantes en clase mis estudiantes se tornaban inquietos y algo dispersos en la explicación del tema, entonces me llene de paciencia e identifique el problema y llame su atención contando en ese momento una anegdota graciosa realizamos un par de chistes y retomamos la concentración de ellos y con relación a las anécdotas seguí explicando mi tema y fue un éxito. ",#retomasuconcentracion,Resultados positivos,Estimular el aprendizaje y transmitir prácticas,Comprensión del mundo que los rodea,Reflexionar y comprender,Las restricciones de tiempo,Estudiantes y padres,Ayudar a los estudiantes a alcanzar los objetivos,Socialmente/en grupo,Liderado por el maestro,Necesidades emergentes,I. E. PROGRESAR,,,,,,,,
10/19/2020 9:15:43,un niño con necesidades educativas se le trabaja con material concreta para que así capte mejor la atención y el aprendizaje sea significativo lo cual lo hace todos los días en su clase y la profe ve que el estudiante a evolucionado ya que en los grados anteriores solo lo colocan a pintar copias.,la evolución de Samuel,Resultados positivos,Estimular el aprendizaje y transmitir prácticas,Comprensión del mundo que los rodea,Aplicar lo aprendido haciendo cosas concretas,"Recursos educativos (ej.. tecnología, fondos, etc.)",Maestros y rectores,Abrir nuevos mundos para los estudiantes,Individual/independientemente,Liderado por el maestro,Prácticas establecidas,I. E. PROGRESAR,,,,,,,,
10/19/2020 9:17:22,Implementé una estrategia en el uso de actividades lúdicas para promover la participación en inglés.,#juegayaprende,Resultados positivos,Estimular el aprendizaje y transmitir prácticas,Habilidades de vida prácticas/pensando en futura empleabilidad,Aplicar lo aprendido haciendo cosas concretas,"Recursos educativos (ej.. tecnología, fondos, etc.)",Maestros y rectores,Ayudar a los estudiantes a alcanzar los objetivos,Socialmente/en grupo,Liderado por el maestro,Necesidades emergentes,I. E. PROGRESAR,,,,,,,,
10/19/2020 9:17:59,"Realizar un blog en el que los estudiantes que no tienen conectividad continua, puedan entrar a ver las actividades en el momento que lo puedan hacer. ",#conblognuncadesconectados ,Resultados interesantes,Estimular el aprendizaje y transmitir prácticas,Habilidades de vida prácticas/pensando en futura empleabilidad,Experimentar y crear,"Recursos educativos (ej.. tecnología, fondos, etc.)",Maestros y rectores,Abrir nuevos mundos para los estudiantes,Socialmente/en grupo,Liderado por el maestro,Necesidades emergentes,I. E. PROGRESAR,,,,,,,,
10/19/2020 9:18:04,"Soy docente de ed. física, en  las ultimas clases estuve realizando Juegos recreativos como el rey pide, Stop","Jugando, ando",Resultados positivos,Estimular el aprendizaje y transmitir prácticas,Comprensión del mundo que los rodea,Experimentar y crear,"Recursos educativos (ej.. tecnología, fondos, etc.)",Maestros y rectores,Dar soporte emocional a los estudiantes,Socialmente/en grupo,Liderado por el maestro,Necesidades emergentes,I. E. PROGRESAR,,,,,,,,
10/19/2020 9:19:10,"Colega, le cuento que aplica los principios de lenguaje positivo dentro del aula, teniendo en cuenta las pautas de programación neutro lingüística. ",#silocreopuedo,Resultados positivos,El desarrollo social del alumno,Buenas bases de comprensión para futuros aprendizajes,Reflexionar y comprender,Las restricciones de tiempo,Estudiantes y padres,Abrir nuevos mundos para los estudiantes,Socialmente/en grupo,Liderado por el maestro,Necesidades emergentes,I. E. PROGRESAR,,,,,,,,
10/19/2020 9:23:48,"Trabaje desde el ser, saber y hacer llevando al alumno a la reflexión ",Reflexionando mi vida,Resultados interesantes,El desarrollo social del alumno,Habilidades de vida prácticas/pensando en futura empleabilidad,Reflexionar y comprender,Habilidades y capacitación,Maestros y rectores,Ayudar a los estudiantes a alcanzar los objetivos,Individual/independientemente,Liderado por el estudiante,Prácticas establecidas,I. E. PROGRESAR,,,,,,,,
10/19/2020 9:24:06,"si he implementado varias  estrategias las cuales las he enfocado con miras que el estudiantes se siente importante y no quiera desistir de sus proceso de formación educativo, esta estrategias fueron: descargar videos con la información, de tal  manera que los estudiante no tengan que gastar sus datos para mirarlos, además las clases explicadas en guías esto para los que no tiene acceso a la internet, la otra estrategia implantada es llamar a los estudiantes a preguntarles como la van pasando o porque no están cumpliendo con su deber escolar ; también  trato de compartirles cuentos o lecturas motivacionales y cuando es un caso que me preocupa por la forma de responder del estudiante, ponerlo en conocimiento de la coordinadora y la psicóloga .",#tùeresmàsqueunasimplenota,Resultados mixtos,Estimular el aprendizaje y transmitir prácticas,Habilidades de vida prácticas/pensando en futura empleabilidad,Reflexionar y comprender,"Recursos educativos (ej.. tecnología, fondos, etc.)",Maestros y rectores,Ayudar a los estudiantes a alcanzar los objetivos,Individual/independientemente,Liderado por el maestro,Necesidades emergentes,I. E. PROGRESAR,,,,,,,,
10/19/2020 9:28:54,"La feria de la Ciencias, en la Institución todos los años se realiza la feria de las ciencias, esta con el fin de dar a conocer trabajos que realizan los estudiantes en diferentes materias, es una integración de áreas que deja ver la creatividad de los estudiantes, para este año y de acuerdo a la pandemia no se dejo de lado esta actividad, por el contrario se trato de vincular a toda la familia en una titiriferia de las ciencias  la cual consta de resolver una pregunta del Covid 19 según su grado de escolaridad para la cual el área de ciencias nos proporciono la información, la realización de un guion que conto con la participación del área de lenguaje y finalmente la realización de los títeres de acuerdo a la materia de artística, de esta forma el producto fue un video que transmitió lo aprendido del Covid 19  a través de un show de títeres que mostro muy buenos resultados ya que la mayoría de la institución (directivos, docentes padres de familia y estudiantes) participo activamente y otras área se vincularon con su trabajo desde diferentes aprendizajes sobre el tema. ",Integración de áreas IE Progresar ,Resultados mixtos,Estimular el aprendizaje y transmitir prácticas,Comprensión del mundo que los rodea,Reflexionar y comprender,"Recursos educativos (ej.. tecnología, fondos, etc.)",Maestros y rectores,Abrir nuevos mundos para los estudiantes,Socialmente/en grupo,Liderado por el estudiante,Necesidades emergentes,I. E. PROGRESAR,,,,,,,,
10/19/2020 9:30:06,"Formación y sensibilización de la comunidad educativa frente al Covid-19, como un modelo para el reconocimiento del entorno que nos rodea y buenas practicas de autocuidado, integrando diferentes asignaturas, cuyo producto final fue la puesta en escena de títeres elaborados por estudiantes y docentes. ",#Titiriferia de las ciencias,Resultados positivos,Estimular el aprendizaje y transmitir prácticas,Comprensión del mundo que los rodea,Aplicar lo aprendido haciendo cosas concretas,"Recursos educativos (ej.. tecnología, fondos, etc.)",Maestros y rectores,Ayudar a los estudiantes a alcanzar los objetivos,Socialmente/en grupo,Liderado por el estudiante,Necesidades emergentes,I. E. PROGRESAR,,,,,,,,
10/19/2020 9:49:47,"Realice una clase por medio de una dinámica llamada 1, 2, 3.",Aprendizaje por medio de dinámica.,Resultados positivos,Estimular el aprendizaje y transmitir prácticas,Habilidades de vida prácticas/pensando en futura empleabilidad,Experimentar y crear,Habilidades y capacitación,Estudiantes y padres,Abrir nuevos mundos para los estudiantes,Socialmente/en grupo,Liderado por el maestro,Necesidades emergentes,I. E. PROGRESAR,,,,,,,,
10/19/2020 9:54:04,"Contaría a mi colega sobre lo que ha sido ser nombrada docente en ""Caminar en Secundaria"". Le narraría que es uno de los muchos modelos flexibles que hay en nuestro país y que se implementa en pro de evitar la alta deserción escolar por parte de niños, niñas y adolescentes entre los 13 y 17 años que tienen un desfase edad - grado, lo que hace que se desmotiven porque se sienten muy grandes para estar en determinado grado. ",#CSmeabraza,Resultados mixtos,El desarrollo social del alumno,Habilidades de vida prácticas/pensando en futura empleabilidad,Experimentar y crear,Las restricciones de tiempo,Maestros y rectores,Ayudar a los estudiantes a alcanzar los objetivos,Individual/independientemente,Liderado por el maestro,Necesidades emergentes,I. E. PROGRESAR,,,,,,,,
